url,title,content,score,source
https://en.wikipedia.org/wiki/Reinforcement_learning,Reinforcement learning - Wikipedia,"Reinforcement learning is one of the three basic machine learning paradigms, alongside supervised learning and unsupervised learning . Reinforcement learning differs from supervised learning in not needing labelled input-output pairs to be presented, and in not needing sub-optimal actions to be explicitly corrected.",0.86799,en.wikipedia.org
https://en.wikipedia.org/wiki/Reinforcement,Reinforcement - Wikipedia,"* **reinforcing stimuli** – stimuli that increase the probability of repeating behaviors paired with them * **rewarding stimuli** – stimuli that the brain interprets as intrinsically positive and desirable or as something to approach * **sensitization** – an amplified response to a stimulus resulting from repeated exposure to it * **substance use disorder** – a condition in which the use of substances leads to clinically and functionally significant impairment or distress * **drug tolerance** – the diminishing effect of a drug resulting from repeated administration at a given dose | In addition, ratio schedules can deliver reinforcement following fixed or variable number of behaviors by the individual organism. Individual behaviors tend to generate response rates that differ based upon how the reinforcement schedule is created.",0.8676200000000001,en.wikipedia.org
https://en.m.wikipedia.org/wiki/Reinforcement_learning,Reinforcement learning - Wikipedia,Reinforcement learning (RL) is an interdisciplinary area of machine learning and optimal control concerned with how an intelligent agent should take actions in a dynamic environment in order to …,0.8668899999999999,en.m.wikipedia.org
https://onlinedegrees.scu.edu/media/blog/9-examples-of-reinforcement-learning,Santa Clara University 9 Real-Life Reinforcement Learning Examples and Use Cases,"August 29, 2025 - AI reinforcement learning (RL) ... learn. It has many practical applications across industries, from autonomous cars to energy conservation to healthcare .2",0.941755,onlinedegrees.scu.edu
https://www.techtarget.com/searchenterpriseai/definition/reinforcement-learning,TechTarget What is reinforcement learning? | Definition from TechTarget,"# What is reinforcement learning? Reinforcement learning (RL) is a machine learning training method that trains software to make certain desired actions. Reinforcement learning is one of several approaches developers use to train machine learning systems. Reinforcement learning is also used in operations research, information theory, game theory, control theory, simulation-based optimization, multi-agent systems, swarm intelligence, statistics, genetic algorithms and ongoing industrial automation efforts. For example, if a robot that was reliant on reinforcement learning was deployed to navigate a complex physical environment, it would seek new states and take different actions as it moves. * **State-action-reward-state-action.** This reinforcement learning algorithm starts by giving the agent what's known as a *policy*. *Machine learning algorithms use one or more training approaches, including reinforcement learning.",0.7901199999999999,www.techtarget.com
https://financetalks.ie.edu/reinforcement-learning-applications-in-finance/,Finance Talks Reinforcement Learning: Applications in Finance | Finance Talks,"January 31, 2020 - Reinforcement learning has been used in various applications in finance and trading, including portfolio optimization and optimal trade execution .",0.938245,financetalks.ie.edu
https://neptune.ai/blog/reinforcement-learning-applications,10 Real-Life Applications of Reinforcement Learning - Neptune,"Reinforcement Learning In **Reinforcement Learning (RL)**, agents are trained on a **reward** and **punishment** mechanism. In this article, we’ll look at some of the real-world applications of reinforcement learning. Various papers have proposed Deep Reinforcement Learning for **autonomous driving**. Wayve.ai has successfully applied reinforcement learning to training a car on how to **drive in a day.** They used a deep reinforcement learning algorithm to tackle the lane following task. Enter Reinforcement Learning (RL). ## Reinforcement Learning applications in healthcare The platform uses reinforcement learning to optimize large-scale production systems. In this paper, the authors propose **real-time bidding** with multi-agent reinforcement learning. The use of deep learning and reinforcement learning can train robots that have the ability to grasp various objects — even those unseen during training.",0.786905,neptune.ai
https://www.ibm.com/think/topics/reinforcement-learning,What is reinforcement learning? | IBM,"Reinforcement learning (RL) is a type of machine learning process in which autonomous agents learn to make decisions by interacting with their environment. While dynamic programming predicts potential future states and reward signals in making decisions, Monte Carlo methods are exclusively experience-based, meaning they sample sequences of states, actions, and rewards solely through interaction with the environment. Recent research suggests leveraging natural language processing techniques and tools—e.g. large language models (LLMs)—may improve generalization in reinforcement learning systems through textual representation of real-world environments.19 Many studies show how interactive textual environments provide cost-effective alternatives to three-dimensional environments when instructing learning agents in successive decision-making tasks.20 Deep reinforcement learning also undergirds textual decision-making in chatbots.",0.7867500000000001,www.ibm.com
https://www.geeksforgeeks.org/machine-learning/what-is-reinforcement-learning/,Reinforcement Learning - GeeksforGeeks,"Reinforcement Learning (RL) is a branch of machine learning that focuses on how agents can learn to make decisions through trial and error to maximize cumulative rewards. RL allows machines to learn by interacting with an environment and receiving feedback based on their actions. * The agent updates its knowledge (policy, value function) based on the reward received and the new state. def get_optimal_path(Q, start, goal, actions, maze, max_steps=200): optimal_path = get_optimal_path(Q, start, goal, actions, maze) * We can observe the total reward trend increasing as the agent learns over time. 8 min readTypes of Machine Learning 7 min readApplications of Machine Learning 9 min readRegularization in Machine Learning 5 min readCross Validation in Machine Learning",0.86085,www.geeksforgeeks.org
https://machinelearningmastery.com/5-groundbreaking-applications-of-reinforcement-learning-in-2024/,MachineLearningMastery 5 Groundbreaking Applications of Reinforcement Learning in 2024 - MachineLearningMastery.com,"Reinforcement Learning (RL) has emerged as a powerful paradigm in artificial intelligence, enabling machines to learn optimal behavior through interaction with their environment. While supply chain optimization using RL isn’t new, the events of recent years have highlighted the need for more resilient and adaptive systems. These advanced systems not only optimize for efficiency but also for resilience, learning from simulated crisis scenarios to develop robust strategies. These advanced robotic systems can now learn complex tasks by observing human demonstrations, understanding verbal instructions, and adapting to new environments with minimal reprogramming. As we witness these groundbreaking applications of reinforcement learning in 2024, it’s clear that we’re only scratching the surface of RL’s potential.",0.7846599999999999,machinelearningmastery.com
https://cloud.google.com/discover/what-is-reinforcement-learning,What is reinforcement learning (RL)? | Google Cloud,"## Building and scaling reinforcement learning solutions on Google Cloud * **For building and training models:** **Vertex AI** is a unified machine learning platform that simplifies the entire ML workflow; you can use it to build, train, and manage your RL models, experiments, and data in one place Usage recommendations for Google Cloud products and services. A unified data-to-AI governance fabric for all Google Cloud services. Free-to-use, cloud-native and AI-powered data migration services. Service for creating and managing Google Cloud resources. Managed and secure development environments in the cloud. Service for executing builds on Google Cloud infrastructure. Deployment and development management for APIs on Google Cloud. Google Cloud audit, platform, and application logs management. Manage quotas for all Google Cloud services.",0.782995,cloud.google.com
https://www.explorepsychology.com/reinforcement-definition/,Types of Reinforcement in Psychology: Definition and Examples,"May 7, 2023 · Reinforcement strengthens behavior. Learn more about the reinforcement definition in psychology, along with examples and how it works to modify behavior.",0.78255,www.explorepsychology.com
https://www.synopsys.com/glossary/what-is-reinforcement-learning.html,What is Reinforcement Learning & How Does AI Use It? | Synopsys,"Tags: Multi-Die, AI & Machine Learning, Signal & Power Integrity, Simulation, Design, About Synopsys, Interface IP, Energy-Efficient SoCs, Foundation IP, Silicon IP, Verification, Virtual Prototyping Tags: AI & Machine Learning, Debug, Prototyping, Simulation, Emulation, About Synopsys, Interface IP, Energy-Efficient SoCs, Foundation IP, Interface IP Subsystems, Verification IP, Virtual Prototyping, Silicon Lifecycle Management, Signal & Power Integrity, Design, Security IP, HPC, Data Center, Silicon IP, Verification Tags: Multi-Die, AI & Machine Learning, RF Design, About Synopsys, Interface IP, Silicon Lifecycle Management, Signal & Power Integrity, Design, Design Technology Co-Optimization, Photonic, Silicon IP, Analog Design, 3DIC Design Tags: Low Power, AI & Machine Learning, Silicon Lifecycle Management, Signal & Power Integrity, Design, About Synopsys, Energy-Efficient SoCs, Verification",0.781195,www.synopsys.com
https://www.merriam-webster.com/dictionary/reinforcement,REINFORCEMENT Definition & Meaning - Merriam-Webster,"Synonyms of *reinforcement* **:** the action of strengthening or encouraging something **:** the state of being reinforced a bridge in need of steel reinforcements positive/negative reinforcement **:** the reward, punishment, or unconditioned stimulus used in reinforcement ## Examples of *reinforcement* in a Sentence Call for *reinforcements*!” The bridge is in need of *reinforcement*. You should encourage good behavior with positive *reinforcement*. See All Example Sentences for *reinforcement* The first known use of *reinforcement* was ## Rhymes for *reinforcement* See All Rhymes for *reinforcement* reinforced concrete reinforcement reinforcer reinforcement **:** something that reinforces reinforcement ˌrē-ən-ˈfōr-smənt, -ˈfȯr-"") **:** the reward, punishment, or unconditioned stimulus used in reinforcement compare recruitment sense 1 ## More from Merriam-Webster on *reinforcement* ## Popular",0.780905,www.merriam-webster.com
https://www.sciencenewstoday.org/what-is-reinforcement-learning-and-how-it-trains-ai,What Is Reinforcement Learning and How It Trains AI,"Apr 25, 2025 · Reinforcement learning also powers recommendation engines, autonomous vehicles, natural language processing, and even scientific discovery, where AI proposes novel experiments and hypotheses. Perhaps most famously, RL powered AlphaGo, the AI that defeated world champion Go players and redefined the boundaries of machine intelligence.",0.853565,www.sciencenewstoday.org
https://pressbooks.online.ucf.edu/lumenpsychology/chapter/operant-conditioning/,Reinforcement and Punishment – General Psychology,"***Reinforcement*** means you are increasing a behavior, and *punishment* means you are decreasing a behavior. All reinforcers (positive or negative) *increase* the likelihood of a behavioral response. All punishers (positive or negative) *decrease* the likelihood of a behavioral response. Positive and Negative Reinforcement and Punishment The most effective way to teach a person or animal a new behavior is with positive reinforcement. In **positive reinforcement**, a desirable stimulus is added to increase a behavior. In **negative reinforcement**, an undesirable stimulus is removed to increase a behavior. Remember that reinforcement, even when it is negative, always increases a behavior. Remember, it is best to reinforce desired behaviors, rather than to use punishment. How could you use behavior modification, specifically positive reinforcement, to change your behavior?",0.9279550000000001,pressbooks.online.ucf.edu
https://web.stanford.edu/class/psych209/Readings/SuttonBartoIPRLBook2ndEd.pdf,"Stanford University i Reinforcement Learning: An Introduction Second edition, in progress","The computational study of reinforcement learning is now a large ﬁeld, with hundreds of active researchers around the world in di-verse disciplines such as psychology, control theory, artiﬁcial intelligence, and neuroscience. We intro-duce dynamic programming, Monte Carlo methods, and temporal-diﬀerence learning. There is a chapter on eligibility traces which uniﬁes the latter two methods, and a chapter that uniﬁes planning methods (such as dynamic pro-gramming and state-space search) and learning methods (such as Monte Carlo and temporal-diﬀerence learning). Machine Learning, 22:123–158. In Proceedings of the Eighth Yale Workshop on Adaptive and Learning Systems, pp. In Reinforcement Learning (pp. C. Collins (eds.), Proceedings of the Eighth International Workshop on Machine Learning, pp. A heuristic approach to reinforcement learning control systems. Reinforcement Learning.",0.926285,web.stanford.edu
https://www.betterhelp.com/advice/psychologists/what-is-reinforcement-psychology-definition-and-applications/,"What Is Reinforcement? Psychology, Definition, And Applications","Jul 10, 2024 · Reinforcement psychology involves the use of providing something or taking it away to achieve a desired behavior. Primary reinforcement occurs naturally, while secondary …",0.775755,www.betterhelp.com
https://oecs.mit.edu/pub/k2ek981x,Open Encyclopedia of Cognitive Science Reinforcement Learning,"December 3, 2024 - Reinforcement learning (RL) refers to a process in which an agent (biological or artificial) learns how to behave in its environment by using a simple type of information: reinforcers, which index how good or bad something is .",0.923705,oecs.mit.edu
https://dictionary.cambridge.org/dictionary/english/reinforcement,REINFORCEMENT | English meaning - Cambridge Dictionary,# Meaning of **reinforcement** in English **reinforcements** (Definition of **reinforcement** from the **Cambridge Advanced Learner's Dictionary & Thesaurus** © Cambridge University Press) ## **reinforcement** | American Dictionary (Definition of **reinforcement** from the **Cambridge Academic Content Dictionary** © Cambridge University Press) ## **reinforcement** | Business English reinforcement (Definition of **reinforcement** from the **Cambridge Business English Dictionary** © Cambridge University Press) ## Examples of reinforcement reinforcement See all examples of reinforcement ## Collocations with reinforcement ## reinforcement positive reinforcement See all collocations with reinforcement What is the pronunciation of *reinforcement*? ## Translations of reinforcement reinforce reinforced reinforcement reinforcements phrase reinforcing + - reinforcement - reinforcements To add **reinforcement** to a word list please sign up or log in.,0.84817,dictionary.cambridge.org
https://medium.com/@nimritakoul01/reinforcement-learning-simply-explained-221fc096096f,Reinforcement Learning — Simply Explained | by Dr.... | Medium,The definition . Reinforcement learning is the type of learning used by humans and other animals to learn .,0.84563,medium.com
https://www.verywellmind.com/what-is-reinforcement-2795414,What Is Reinforcement in Operant Conditioning? - Verywell Mind,"Apr 4, 2023 · Reinforcement is an important concept in operant conditioning and the learning process. Learn how it's used and see conditioned reinforcer examples in everyday life.",0.7700400000000001,www.verywellmind.com
https://www.oxfordlearnersdictionaries.com/definition/english/reinforcement,"reinforcement noun - Definition, pictures, pronunciation and usage …","Definition of reinforcement noun in Oxford Advanced Learner's Dictionary. Meaning, pronunciation, picture, example sentences, grammar, usage notes, synonyms and more.",0.76942,www.oxfordlearnersdictionaries.com
https://julius.ai/glossary/reinforcement-learning,Julius AI | Reinforcement Learning,"Reinforcement Learning . Definition , types, and examples. Definition . Formally, reinforcement learning is defined as a computational approach to learning from interaction.",0.7690049999999999,julius.ai
https://deepai.org/machine-learning-glossary-and-terms/reinforcement-learning,Reinforcement Learning Definition | DeepAI,"Reinforcement learning is all about the interaction between the agent and the environment. In a typical RL scenario, the agent chooses actions that affect the state of the environment.",0.8419650000000001,deepai.org
https://www.ebsco.com/research-starters/psychology/reinforcement,Reinforcement | Research Starters - EBSCO,Reinforcement is a fundamental concept in psychology that refers to consequences of behavior that increase the likelihood of that behavior being repeated in the future. This principle is central to …,0.76581,www.ebsco.com
https://builtin.com/artificial-intelligence/reinforcement-learning,"What Is Reinforcement Learning ? ( Definition , Uses) | Built In",Reinforcement learning relies on an agent learning to determine accurate solutions from its own actions and the results produced in a contained environment.,0.7653300000000001,builtin.com
https://www.g2.com/articles/reinforcement-learning,What Is Reinforcement Learning ? Definition and Applications,Reinforcement learning is an area of machine learning focused on how AI agents should take action in a particular situation to maximize the total reward.,0.7627999999999999,www.g2.com
https://www.v7labs.com/blog/reinforcement-learning-applications,9 Reinforcement Learning Real-Life Applications,"Reinforcement Learning models are trained in a dynamic environment by learning a policy from its own experiences following the principles of exploration and exploitation that minimize disruption to traffic. Reinforcement Learning agents are trained in these dynamic environments to optimize trajectories. There are some limitations in applying deep Reinforcement Learning algorithms to transportation networks, like an exploration-exploitation dilemma, multi-agent training schemes, continuous action spaces, signal coordination, etc. In Reinforcement Learning, the agent should be trained for all the aspects of the game like path finding, defense, attack and creating situation based strategies to make the game interesting for the opponent. * Reinforcement Learning also finds application in self-driving cars to train an agent for optimizing trajectories and dynamically planning the most efficient path.",0.76171,www.v7labs.com
https://datamites.com/blog/reinforcement-learning-basics-and-applications/,Reinforcement Learning : Basics and Applications,"Reinforcement Learning represents a powerful tool in the evolution of AI, with applications stretching from gaming to healthcare and autonomous vehicles.",0.7593799999999999,datamites.com
https://www.miquido.com/ai-glossary/reinforcement-learning/,Understanding Reinforcement Learning Meaning | Miquido,Explore a simple explanation of reinforcement learning . Dive into its core concepts with our easy-to-understand guide at Miquido.,0.75922,www.miquido.com
https://www.theiotacademy.co/blog/reinforcement-learning/,"Dive Deep in Reinforcement Learning : Types, Tools and Examples","Reinforcement Learning Definition . It is a type of machine learning , where an agent learns to make choices by interacting with its surroundings to get the most rewards.",0.75732,www.theiotacademy.co
https://intellipaat.com/blog/applications-of-reinforcement-learning/,Applications of Reinforcement Learning - Top Industrial Examples,"Several gaming applications make use of reinforcement learning , one of them being the game of Othello. In this, reinforcement learning , along with a combination of the function",0.75666,intellipaat.com
https://dev.to/galyna_chekan/reinforcement-learning-applications-107f,Reinforcement Learning Applications - DEV Community,"In this post, we’ll list possible reinforcement learning applications and explain without technical jargon how RL works in general. Supervised Learning , Unsupervised Learning , and",0.7558400000000001,dev.to
https://www.vationventures.com/glossary/reinforcement-learning-definition-explanation-and-use-cases,"Reinforcement Learning : Definition , Explanation... | Vation Ventures","Reinforcement Learning : Definition , Explanation, and Use Cases. Reinforcement Learning (RL) is a type of machine learning that is based on the principle of reward and punishment.",0.755145,www.vationventures.com
https://aws.amazon.com/what-is/reinforcement-learning/,AWS What is Reinforcement Learning? - Reinforcement Learning Explained - AWS,"Reinforcement learning (RL) is a machine learning (ML) technique that trains software to make decisions to achieve the most optimal results. Instead, model-free RL algorithms adapt quickly to continuously changing environments and find new strategies to optimize results. The learning process of reinforcement learning (RL) algorithms is similar to animal and human reinforcement learning in the field of behavioral psychology. While supervised learning, unsupervised learning, and reinforcement learning (RL) are all ML algorithms in the field of AI, there are distinctions between the three. While reinforcement learning (RL) applications can potentially change the world, it may not be easy to deploy these algorithms. Amazon Web Services (AWS) has many offerings that help you develop, train, and deploy reinforcement learning (RL) algorithms for real-world applications.",0.753925,aws.amazon.com
https://datasciencedojo.com/blog/reinforcement-learning-from-human-feedback/,Reinforcement Learning from Human Feedback for Smarter AI,"Fine-tuning a model with Reinforcement Learning from Human Feedback involves a multi-step process designed to align the model with human preferences. A preference dataset is a collection of data that captures human preferences regarding the outputs generated by a language model. Training the reward model is a pivotal step in the RLHF process, transforming human feedback into a quantitative signal that guides the learning of an AI system. Reinforcement Learning from Human Feedback (RLHF) is essential for aligning AI systems with human values and enhancing their performance in various applications, including chatbots, image generation, music generation, and voice assistants. By leveraging human feedback to train reward models and using reinforcement learning for fine-tuning, RLHF ensures that AI-generated content is more accurate, relevant, and satisfying.",0.75364,datasciencedojo.com
https://www.sciencedirect.com/topics/computer-science/reinforcement-learning,ScienceDirect Reinforcement Learning - an overview | ScienceDirect Topics,"Reinforcement learning is a reward/punishment-based learning technique where, a teacher or critic is present not to guide just like in supervised learning, but punishes for the wrong actions and rewards for the correct actions . In reinforcement learning, unlike unsupervised learning, a sort",0.7516700000000001,www.sciencedirect.com
https://www.oreilly.com/radar/practical-applications-of-reinforcement-learning-in-industry/,Practical applications of reinforcement learning in industry – O’Reilly,"The key for companies is to start with simple uses cases that fit this profile rather than overly complicated problems that “require AI.” To make things more concrete, let me highlight some of the key application domains where RL is beginning to appear. Applications of RL in high-dimensional control problems, like robotics, have been the subject of research (in academia and industry), and startups are beginning to use RL to build products for industrial robotics. Bonsai is one of several startups building tools to enable companies to use RL and other techniques for industrial applications. Several researchers are investigating the use of RL and other machine learning methods in tutoring systems and personalized learning.",0.75126,www.oreilly.com
https://store-restack.vercel.app/p/ai-for-industrial-automation-answer-reinforcement-learning-applications-cat-ai,Reinforcement Learning Applications in Automation | Restackio,"Reinforcement learning has numerous applications in robotics automation, particularly in areas requiring complex manipulation and navigation. Some notable applications include",0.749625,store-restack.vercel.app
https://huggingface.co/tasks/reinforcement-learning,Hugging Face What is Reinforcement Learning? - Hugging Face,"In model free reinforcement learning, agent decides on optimal actions based on its experience in the environment and the reward it collects from it. This is one of the most commonly used algorithms beneficial in complex environments, where modeling of state transition probabilities and reward functions are difficult.",0.7483299999999999,huggingface.co
