url,title,content,score,source
https://imubit.com/article/reinforcement-learning-in-industry/,Imubit 3 Powerful Reinforcement Learning Applications in Industry,"Reinforcement Learning (RL) sits at the heart of this momentum, translating complex plant data into experience-based real-time decisions that move profitability, reliability, and sustainability together. This foundation allows RL to explore various states, select optimal actions, and adaptively learn from feedback to maximize cumulative rewards over time. The dynamic learning capability helps operations achieve increased efficiency by reducing energy consumption and optimizing production processes without constant human intervention. Furthermore, these systems optimize maintenance activities based on real-time data, as opposed to static, calendar-based schedules, leading to more efficient and cost-effective operations. For process industry leaders seeking sustainable efficiency improvements, Imubit’s Closed Loop AI Optimization solution offers a data-first approach grounded in real-world operations.",0.746525,imubit.com
https://pg-p.ctme.caltech.edu/blog/ai-ml/what-is-reinforcement-learning,Caltech - What is Reinforcement Learning in AI? - Caltech,"May 21, 2024 - If you make the wrong decision, you inevitably suffer consequences. Eventually, through experience, we learn to take actions that offer the best outcomes while avoiding negative results. Machines can be trained to do this, too. It’s called reinforcement learning.",0.896315,pg-p.ctme.caltech.edu
https://www.eletimes.ai/top-10-reinforcement-learning-applications-and-use-cases,ELE Times Top 10 Reinforcement Learning Applications and Use Cases - ELE Times,"[Sign in](https://www.eletimes.ai/top-10-reinforcement-learning-applications-and-use-cases) * [Technology](https://www.eletimes.ai/technology) * [5G](https://www.eletimes.ai/technology/5g) * [Automation and Robotics](https://www.eletimes.ai/technology/automation-and-robotics) * [Automotive](https://www.eletimes.ai/technology/e-mobility) * [Consumer](https://www.eletimes.ai/technology/consumer) * [Microcontrollers](https://www.eletimes.ai/technology/microcontrollers) * [Power Management](https://www.eletimes.ai/technology/power-management) * [Security](https://www.eletimes.ai/technology/security) * [Electronics](https://www.eletimes.ai/electronics) * [Manufacturing](https://www.eletimes.ai/manufacturing) * [Industry](https://www.eletimes.ai/priority-markets) [Forgot your password?](https://www.eletimes.ai/top-10-reinforcement-learning-applications-and-use-cases#) [](https://www.eletimes.ai/top-10-reinforcement-learning-applications-and-use-cases#) * [About ELE Times](https://www.eletimes.ai/about) September 10, 2025 [](https://www.eletimes.ai/top-10-reinforcement-learning-applications-and-use-cases#)[](https://www.eletimes.ai/top-10-reinforcement-learning-applications-and-use-cases#) * [Technology](https://www.eletimes.ai/technology) October 1, 2025 [](https://www.eletimes.ai/top-10-reinforcement-learning-applications-and-use-cases#)[](https://www.eletimes.ai/top-10-reinforcement-learning-applications-and-use-cases#) * [Electronics](https://www.eletimes.ai/electronics) October 1, 2025 [](https://www.eletimes.ai/top-10-reinforcement-learning-applications-and-use-cases#)[](https://www.eletimes.ai/top-10-reinforcement-learning-applications-and-use-cases#) * [Manufacturing](https://www.eletimes.ai/manufacturing) September 23, 2025 [](https://www.eletimes.ai/top-10-reinforcement-learning-applications-and-use-cases#)[](https://www.eletimes.ai/top-10-reinforcement-learning-applications-and-use-cases#) * [Industry](https://www.eletimes.ai/priority-markets) September 30, 2025 [](https://www.eletimes.ai/top-10-reinforcement-learning-applications-and-use-cases#)[](https://www.eletimes.ai/top-10-reinforcement-learning-applications-and-use-cases#) September 24, 2025 [](https://www.eletimes.ai/top-10-reinforcement-learning-applications-and-use-cases#)[](https://www.eletimes.ai/top-10-reinforcement-learning-applications-and-use-cases#) September 10, 2025 [](https://www.eletimes.ai/top-10-reinforcement-learning-applications-and-use-cases#)[](https://www.eletimes.ai/top-10-reinforcement-learning-applications-and-use-cases#) * [Technology](https://www.eletimes.ai/technology) October 1, 2025 [](https://www.eletimes.ai/top-10-reinforcement-learning-applications-and-use-cases#)[](https://www.eletimes.ai/top-10-reinforcement-learning-applications-and-use-cases#) * [Electronics](https://www.eletimes.ai/electronics) October 1, 2025 [](https://www.eletimes.ai/top-10-reinforcement-learning-applications-and-use-cases#)[](https://www.eletimes.ai/top-10-reinforcement-learning-applications-and-use-cases#) * [Manufacturing](https://www.eletimes.ai/manufacturing) September 23, 2025 [](https://www.eletimes.ai/top-10-reinforcement-learning-applications-and-use-cases#)[](https://www.eletimes.ai/top-10-reinforcement-learning-applications-and-use-cases#) * [Industry](https://www.eletimes.ai/priority-markets) September 30, 2025 [](https://www.eletimes.ai/top-10-reinforcement-learning-applications-and-use-cases#)[](https://www.eletimes.ai/top-10-reinforcement-learning-applications-and-use-cases#) September 24, 2025 [](https://www.eletimes.ai/top-10-reinforcement-learning-applications-and-use-cases#)[](https://www.eletimes.ai/top-10-reinforcement-learning-applications-and-use-cases#) [Electronics](https://www.eletimes.ai/electronics) [Microcontrollers](https://www.eletimes.ai/technology/microcontrollers) [Industry](https://www.eletimes.ai/priority-markets) * [About ELE Times](https://www.eletimes.ai/about) * [5G](https://www.eletimes.ai/technology/5g) * [Automation and Robotics](https://www.eletimes.ai/technology/automation-and-robotics) * [Automotive](https://www.eletimes.ai/technology/e-mobility) * [Consumer](https://www.eletimes.ai/technology/consumer) * [Microcontrollers](https://www.eletimes.ai/technology/microcontrollers) * [Power Management](https://www.eletimes.ai/technology/power-management)",0.7449600000000001,www.eletimes.ai
https://www.mathworks.com/discovery/reinforcement-learning.html,MathWorks What Is Reinforcement Learning? - MATLAB & Simulink,"Using reinforcement learning terminology (Figure 2), the goal of learning in this case is to train the dog (agent) to complete a task within an environment, which includes the surroundings of the dog as well as the trainer. So, the whole meaning of reinforcement learning training is to “tune” the dog’s policy so that it learns the desired behaviors that will maximize some reward. The general workflow for training an agent using reinforcement learning includes the following steps (Figure 4): Then you create the agent, which consists of the policy and the reinforcement learning training algorithm. Training an agent using reinforcement learning is an iterative process. * Creating and Training Reinforcement Learning Agents Interactively (5:38)",0.74347,www.mathworks.com
https://botpenguin.com/glossary/reinforcement-learning,BotPenguin Reinforcement Learning: Types & Applications | BotPenguin,"Reinforcement learning has important applications for robotics, gaming, finance, and autonomous driving , among others.",0.742275,botpenguin.com
https://www.nvidia.com/en-us/glossary/reinforcement-learning/,NVIDIA What is Reinforcement Learning? | NVIDIA Glossary,Reinforcement learning (RL) is a type of machine learning technique that enables robots to make intelligent decisions by learning from experience .,0.741165,www.nvidia.com
https://randomtrees.com/aiaccelerators/complete-guide-to-reinforcement-learning-application-tool-and-advancements/,"RandomTrees Complete Guide to Reinforcement Learning Application, Tool and Advancements","October 7, 2022 - Pytorch, an open-sourced deep learning library by Facebook, is another widely used deep learning library. Due to its ease of use, PyTorch continues to gain popularity. PyTorch primarily serves researchers, data scientists, and AI (artificial intelligence) and is frequently used for experiments on implementing policy-based agents and creating new adventures, thanks to its dynamic neural networks and strong GPU acceleration. There have been several research papers proposing Deep Reinforcement Learning for autonomous vehicles.",0.740435,randomtrees.com
https://arxiv.org/abs/2307.11046,arXiv [2307.11046] A Definition of Continual Reinforcement Learning,"December 1, 2023 - In a standard view of the reinforcement learning problem, an agent's goal is to efficiently identify a policy that maximizes long-term reward. However, this perspective is based on a restricted view of learning as finding a solution, rather than treating learning as endless adaptation.",0.814215,arxiv.org
https://www.marktechpost.com/2022/10/03/top-real-world-applications-of-reinforcement-learning-in-2022/,MarkTechPost Top Real World Applications of Reinforcement Learning in 2022 - MarkTechPost,"February 23, 2025 - Reinforcement Learning has applications in numerous fields – Self-driving cars, Robotics, Healthcare, Gaming , etc.",0.73535,www.marktechpost.com
https://smartlabai.medium.com/reinforcement-learning-algorithms-an-intuitive-overview-904e2dff5bbc,Medium Reinforcement Learning algorithms — an intuitive overview | by SmartLab AI | Medium,"> Model-free RL, on the other hand, uses experience to learn directly one or both of two simpler quantities (state/ action values or policies) which can achieve the same optimal behavior but without estimation or use of a world model. Two main approaches to represent agents with model-free reinforcement learning is Policy optimization and Q-learning. In policy optimization methods the agent learns directly the policy function that maps state to action. Simply as it sounds, these methods combine the strengths of Q-learning and policy gradients, thus the policy function that maps state to action and the action-value function that provides a value for each action is learned.",0.810025,smartlabai.medium.com
https://tech.yahoo.com/articles/definition-reinforcement-learning-211126239.html,The Definition of Reinforcement Learning - tech.yahoo.com,"Apr 3, 2025 · What is "" Reinforcement Learning ""? Reinforcement Learning (RL) is a type of machine learning where a model learns to make decisions by interacting with an environment. Unlike …",0.7332,tech.yahoo.com
